{"status":"ACCEPTED","requirementCoverage":[{"requirementId":"req-release-ac1","evidenceRefs":[{"evidenceId":"ev-browse-adapter-tests","acceptanceSignalId":"sig-browse-digest-binding"},{"evidenceId":"ev-browse-strict-resolver","acceptanceSignalId":"sig-browse-digest-binding"}],"status":"covered"},{"requirementId":"req-release-ac2","evidenceRefs":[{"evidenceId":"ev-parity-tests","acceptanceSignalId":"sig-outcome-parity-gate"},{"evidenceId":"ev-required-lane","acceptanceSignalId":"sig-outcome-parity-gate"}],"status":"covered"},{"requirementId":"req-release-ac3","evidenceRefs":[{"evidenceId":"ev-review-persistence","acceptanceSignalId":"sig-review-records-resolve"}],"status":"covered"},{"requirementId":"req-release-ac4","evidenceRefs":[{"evidenceId":"ev-changelog","acceptanceSignalId":"sig-changelog-present"}],"status":"covered"}],"evidenceEntailment":"supported","technical":[{"status":"pass"}],"functional":[{"status":"pass"}],"findings":[],"schema":"csm-orchestrate-adversarial-review/2","reviewId":"review-7aefc81cc340ede2295111d59c67e1ee","runId":"run-orchestrate-release-g1","phaseId":"phase-release-final-review","independent":true,"inputDigest":"sha256:f0032e25d3dd9733e275d31339d3c85c32354fff04da5fdc23303128aaedd542","artifactIdentity":"verified","provenance":{"mode":"in-process-independent","reviewer":"csm-release-reviewer-g1","executor":"csm-orchestrate-final-review","owner":"csm-release-reviewer-g1","reviewerChildRunId":"run-7aefc81cc340ede2295111d59c67e1ee","receipt":{"artifactId":"receipt-final-review-7aefc81cc340ede2295111d59c67e1ee","runId":"run-7aefc81cc340ede2295111d59c67e1ee","owner":"csm-release-reviewer-g1","schema":"csm-review-receipt/1","path":"review-receipt-run-7aefc81cc340ede2295111d59c67e1ee.json","resolution":"in-process-independent-review","digest":"sha256:385af8e0cb6e959e4ccee8925686cbe614d097aeede2555ebe082ee1327f2b92"},"artifact":{"artifactId":"art-final-review-7aefc81cc340ede2295111d59c67e1ee","runId":"run-7aefc81cc340ede2295111d59c67e1ee","owner":"csm-release-reviewer-g1","schema":"csm-orchestrate-adversarial-review/2","path":"review-run-7aefc81cc340ede2295111d59c67e1ee.json","resolution":"in-process-independent-review","digest":"sha256:8f1e81357939b04c8c4be3604243d6ee6fcaab7aa193055f4eaec92c58268211"},"approval":{"approvalId":"approval-final-review-7aefc81cc340ede2295111d59c67e1ee","edgeId":"edge-release-review","parentRunId":"run-orchestrate-release-g1","reviewerChildRunId":"run-7aefc81cc340ede2295111d59c67e1ee","phaseId":"phase-release-final-review","approvedDigest":"sha256:8f1e81357939b04c8c4be3604243d6ee6fcaab7aa193055f4eaec92c58268211"}},"owner":"csm-release-reviewer-g1","sourceDigest":"sha256:f0032e25d3dd9733e275d31339d3c85c32354fff04da5fdc23303128aaedd542","sourceRunId":"run-7aefc81cc340ede2295111d59c67e1ee","sourceArtifactIds":["art-final-review-7aefc81cc340ede2295111d59c67e1ee"]}
